<?xml version="1.0" encoding="UTF-8"?>
<xs:schema xmlns:xs="http://www.w3.org/2001/XMLSchema">

  <!-- Élément racine -->
  <xs:element name="classe">
    <xs:complexType>
      <xs:sequence>
        <xs:element name="etudiant" maxOccurs="unbounded">
          <xs:complexType>
            <xs:sequence>
              <xs:element name="nom" type="xs:string"/>
              <xs:element name="prenom" type="xs:string"/>
            </xs:sequence>
          </xs:complexType>
        </xs:element>
      </xs:sequence>
    </xs:complexType>
  </xs:element>

</xs:schema>
